{
  "sodium": 148,
  "chloride": 144,
  "potassium_plas": 2.7,
  "co2_totl": 16,
  "bun": 40,
  "creatinine": 2.42,
  "calcium": 6.9,
  "glucose": 181,
  "sodium_prior": 132,
  "chloride_prior": 83,
  "potassium_plas_prior": 4.5,
  "co2_totl_prior": 24,
  "bun_prior": 49,
  "creatinine_prior": 3.62,
  "calcium_prior": 10.3,
  "glucose_prior": 135
}
